France,Rail unions’ protests,Mar-18,Free,"Announcement of plans to reduce retirement benefits, reform unemployment insurance, and permit competition to the national rail service.",Threats to public services and public sector employees.,"200,000","Public sector workers, trade unions, students.",2 months,No policy/leadership change in response to the protests.,,,X,,Hundreds of thousands,,X,X,X,,Paris
France,Labor reform protests,Sep-17,Free,Changes to private sector labor laws that would reduce damages for fired workers and favor companies in negotiations with workers.,Perceptions of President Emmanuel Macron's administration as overly favorable to businesses.,"200,000","Trade unions, general public.",2 weeks,No policy/leadership change in response to the protests.,,,X,,Tens of thousands,X,,X,,,Paris
Gabon,Education grant protests,Apr-19,Not free,The announcement of government plans to reduce access to tuition grants.,Frustration over the high cost of living and difficulties in accessing higher education.,">1,000",Secondary school students.,1 week,The government suspended the reform plans.,,,X,X,Tens of thousands,X,,,,,Libreville
Gambia,“Three Years Is Enough” protests,Dec-19,Partly free,Concerns that President Adama Barrow would renege on his promise to rule for only three years in a provisional government before calling elections and not running.,"Lack of political reforms, democratic backslide, and lack of government transparency.","10,000",General public.,1 month,No policy/leadership change in response to the protests.,,X,X,X,Tens of thousands,,,X,,,Banjul
Gaza Strip,“Great March of Return” protests,Mar-18,Not free,"Israeli economic blockade of the Gaza Strip, and Palestinian demand for the right to return to land in what is currently considered Israel.","Economic crisis caused by the blockade (including high unemployment along with electricity and food shortages), and Palestinians’ demand for the right to return.","40,000",Palestinians.,"1 year, 9 months",No policy/leadership change in response to the protests.,,X,X,,Hundreds of thousands,,X,X,,,Gaza
Georgia,Local elections protests,Oct-21,Partly free,"The ongoing detention of former president Mikheil Saakashvili; the announcement of municipal election results favorable to the ruling party, Georgian Dream.","Concerns over electoral integrity, the independence of the judicial system, and the perceived entrenchment of Georgian Dream.",">10,000","Opposition party members, especially members of the United National Movement.",3 months,No policy/leadership change in response to protest.,,,X,,Thousands,,,,,,Tbilisi
Georgia,Journliast murder protest,Jul-21,Partly free,The murder of journalist Alexander Lashkarava.,Frustration with anti-LGBT attitudes and violence against journalists.,">1,000",General public.,1 day,No policy/leadership change in response to protest.,,,X,,Thousands,,,,,,Tbilisi
Georgia,Opposition leader arrest protests,Feb-21,Partly free,The arrest of opposition United National Movement leader Nika Melia.,Perceived entrenchment of the ruling Georgia Dream party and a crackdown on political opposition and dissent.,">5,000",General public.,2 weeks,No policy/leadership change in response to protests.,,,X,,Thousands,,,,,,Tbilisi
Georgia,Electoral protest,Oct-20,Partly free,Announcement of electoral results that showed the ruling Georgia Dream party with a significant lead.,"Belief that the electoral results were politically manipulated, that opposition parties had been deliberately kept out of power, and that oligarch and Georgia Dream founder Bidzina Ivanishvili retains an outsized level of influence.",">1,000","General public, especially opposition politicians.",3 weeks,No policy or leadership change in response to the protests.,,,X,,Thousands,,,,,,Tbilisi
Georgia,Electoral reform protests,Oct-19,Partly free,Parliament's failure to pass electoral reform that would change the system to proportional representation.,"Democratic backslide, crackdown on political opponents, and discontent with the electoral system that advantages the ruling party.","20,000",General public.,1 week,No policy/leadership change in response to the protests.,,,X,X,Tens of thousands,X,,,,,Tbilisi
Georgia,Russian interference protests,Jun-19,Partly free,"Russian lawmaker’s entry into the Georgian Parliament, during which he took the speaker’s seat.",Concerns that the ruling party is too friendly to Russia.,"10,000",General public.,1 week,"Then parliament speaker Irakli Kobakhidze resigned, and a proposal was made to change to an electoral system based on proportional representation.",,,X,,Thousands,,,,,,Tbilisi
Germany,Coronavirus restriction protests,Apr-20,Free,Enactment of strict lockdown measures and vaccine mandates.,Economic damage brought on by restrictions and political contestation over the threat posed by the virus.,">30,000","Right- and left-wing extremists, conspiracy theorists, antivaccine groups.","16 months, intermittently",No policy/leadership change in response to the protests.,,X,X,,Tens of thousands,,,,X,X,Berlin
Germany,Police brutality protests,Jun-20,Free,"Death of George Floyd in the United States, sparking protests against local police brutality and racism in Germany.","Police brutality, systemic racism, and lack of government recognition of systemic racism.",">100,000",General public.,1 month,No policy/leadership change in response to the protests.,,,X,,Unknown,,,X,,X,Berlin
Germany,Far-right pact protests,Feb-20,Free,"Cooperation between the state branches of far-right party Alternative for Germany (AfD) and the center-right Christian Democratic Union and left-leaning Free Democratic Party (FDP) to oust the state premier of Thuringia, Bodo Ramelow, and replace him with Thomas Kemmerich, a member of the FDP. The pact was a visible violation of mainstream political norms that opposed cooperating with far-right parties.",State-level mainstream parties’ cooperation with far-right parties.,"18,000","Unions, antifascist groups, young people.",1 week,"The manner of Ramelow’s dismissal prompted outrage that led to the resignation of the ruling Christian Democratic Union’s chair, Annegret Kramp-Karrenbauer, Chancellor Angela Merkel’s handpicked successor. Kemmerich eventually stepped down from his position as state premier, after which Ramelow reclaimed the post.",,,X,,Tens of thousands,,,,,,Berlin
Ghana,#FixTheCountry protest,Aug-21,Free,Call for protests by activists on social media after tax hikes and increases in fuel prices.,"Frustration with high cost of living, perceived corruption, and poor infrastructure and living conditions.",">5,000",Youth and general public.,1 day,No policy/leadership change in response to protest.,,X,X,X,Thousands,,,,,,Accra
Greece,Economic protest,Apr-22,Free,A call for protest by two of the country's largest labor unions.,"Economic discontent as high inflation, especially for agricultural goods and fuel, strains household resources; frustration with the government for taking insufficient measures to address inflation.",">10,000",General public.,1 day,No policy/leadership change in response to protests.,,X,X,,Thousands,,,,,,Athens
Greece,Labor reform bill protests,Jun-21,Free,Introduction and adoption of a labor reform bill that relaxed employer restrictions on overtime and employee hours.,"Frustration with the court’s determination amid rising anti-Semitic violence, and a sense of a lack of accountability for her death.",">5,000",General public; labor unions.,1 week,No policy/leadership change in response to the protests.,,X,X,,Thousands,,,,,,Athens
Greece,Protest law protests,Jul-20,Free,The Kryiakos Mitsotakis government’s enactment of a stringent law on demonstrations.,Protection of the right to free assembly and discontent with the government’s move to stifle dissent.,">10,000",General public.,1 week,No policy or leadership change in response to the protests.,,X,X,,Hundreds of thousands,,X,,,,Athens
Greece,Pension reform strike,Feb-20,Free,Twenty-four-hour strike in response to proposed pension reform.,"Citizens' fears of pension cuts, which could require them to retire later.","10,000",Public sector trade unions.,1 day,No policy/leadership change in response to the protests.,,,X,,Thousands,,,,,,Athens
Guatemala,Anti-corruption protests,Jul-21,Partly free,"The firing of Juan Francisco Sandoval, the head of the Special Prosecutor’s Office Against Impunity, by Attorney General Maria Porras.",Frustration with impunity for pervasive corruption and the reduction of judicial independence.,">10,000","General public, especially indigenous and student groups.",2 weeks,No policy/leadership change in response to protest.,,,X,X,Tens of thousands,,,,,,Guatemala City
Guatemala,Budget protests,Nov-20,Partly free,"Adoption of a government budget bill that included spending cuts for public health, education, the judiciary, and social support programs while increasing stipends for lawmakers.","Widespread dissatisfaction with systemic corruption, weakening state support for vulnerable populations, and an ineffective government response to the coronavirus pandemic.",">5,000",General public.,1 month,The govermnent withdrew the budget bill.,,,X,X,Thousands,X,,,,X,Guatemala City
Guinea,Municipal election protests,Feb-18,Partly free,Delays in the announcement of final vote results for the 2018 municipal elections and a concurrent call for strikes by teachers to protest low pay.,Concerns about electoral manipulation and frustration over poor teacher pay.,">1,000",General public.,2 months,No policy/leadership change in response to protests.,,X,X,X,Tens of thousands,X,,,,,Conakry
Guinea,Term limit protests,Oct-19,Partly free,Suspicions that President Alpha Condé would seek a third term by amending the constitution.,Rising authoritarianism and repression of dissent and protests.,">100,000","Coalition of politicians, activists.",1 month,No policy/leadership change in response to the protests.,,,X,,Hundreds of thousands,,X,X,X,,Conakry
Haiti,Presidential protests,Feb-21,Partly free,"President Jovenel Moïse’s assertion that his five-year term as president would end in February 2022 rather than February 2021, the assassination of Moïse in July 2021, and rising levels of criminal violence.","Concerns over entrenchment of the Moïse government, lack of elections, systemic corruption, economic deterioration, and increasing political instability.",">1,000",General public.,5 months,No policy/leadership change in response to protests.,,X,X,X,Thousands,,,,X,,Port-au-Prince
Haiti,Tax protests,Sep-17,Partly free,"Introduction of new taxes on cigarettes, passports, and other goods.","Anger over the increasing cost of living, lack of economic opportunity, and the failure of the government to provide basic services.",">1,000",General public.,2 months,No policy/leadership change in response to protests.,,,X,,Unknown,,,,,X,Port-au-Prince
Haiti,“March for Life” protest,Dec-20,Partly free,Anniversary of International Human Rights Day and enactment of a new law on public security.,Concern over President Jovenel Moïse’s ongoing rule by decree; deepening economic and social insecurity; and concerns over perceived repression of antigovernment movements.,">1,000",Opponents of Moïse’s government.,1 day,No policy or leadership change in response to the protests.,,X,X,,Thousands,,,,,,Port-au-Prince
Haiti,PetroCaribe protests,Jul-18,Partly free,"Revocation of fuel subsidies, and revelations of President Jovenel Moïse’s direct involvement in a corruption scandal.","Poverty, corruption, lack of economic development despite economic aid, and inadequate public services and infrastructure.",">10,000","Political opposition, young people, union workers, university professors, business associations, middle-class participants.","1 year, 5 months","In July 2018, the fuel hike was reversed, and then prime minister Jack Guy Lafontant resigned.",,,X,,Thousands,,,,,,Port-au-Prince
Honduras,Privatization reform protests,Apr-19,Partly free,"Proposed reforms to the education and healthcare sectors, and revelations that President Juan Orlando Hernández received contributions from drug traffickers.","Government corruption, falling spending on public services, and widespread poverty despite economic growth.",">10,000","Teachers, medical professionals, unions, trade groups, farmers, taxi and truck drivers, police officers.",6 months,Hernández withdrew the proposed legislation.,,X,X,X,Thousands,X,,X,,,Tegucigalpa
Honduras,2017 election protests,Dec-17,Partly free,"Significant irregularities in the reporting of the results of the December 2017 presidential election, which President Juan Orlando Hernández won narrowly.","Electoral fraud and broader democratic erosion (in other words, subversion of term limits).",">10,000","Political opposition, religious institutions.",2 weeks,No policy/leadership change in response to the protests.,,X,,X,Thousands,X,,,X,,Tegucigalpa
Hong Kong,Democracy activist arrest protest,Feb-21,Partly free,The arrest of forty-seven prominent pro-democracy activists.,Anger at decreasing political pluralism and increased repression by mainland Chinese authorities.,>500,General public.,1 day,No policy/leadership change in response to the protest.,,,X,,Hundreds,,,,,,Hong Kong
Hong Kong,Hong Kong autonomy protests,Apr-19,Partly free,"In 2019, introduction of a bill that would permit extradition of criminal suspects from Hong Kong to China. In 2020, introduction of a new national security law that would criminalize acts of secession, subversion of the central government, terrorism, or conspiracy with foreign influences, as well as permit Chinese law enforcement agencies to operate in Hong Kong.","Erosion of Hong Kong’s one country, two systems autonomy from China, and restriction of civil liberties.","2,000,000","General public, especially younger citizens and students.","1 year, 4 months (sporadic)","The Hong Kong government retracted the extradition bill. It also stepped back from postponing local council elections, which pro-democracy groups won.",,,X,,Thousands,X,,,,,Hong Kong
Hong Kong,Sentencing protest,Aug-17,Partly free,Sentencing of three leaders of the 2014 Umbrella Movement to six to eight months in prison on the charge of unlawful assembly.,"Restriction of civil liberties, autonomy from China, and questions over judicial independence.","22,000",General public.,1 day,No policy/leadership change in response to the protests.,,,X,X,Hundreds of thousands,,X,,X,,Hong Kong
Hungary,LGBT law protests,Jun-21,Partly free,Introduction and adoption of a law that bars teaching about same-sex relationships or LGBT issues to youth.,"Decreasing civic space, repression of LGBT groups, and increasing authoritarianism of Prime Minister Viktor Orban’s government.",">1,000","General public, especially LGBT activists.",3 weeks,No policy/leadership change in response to protest.,,,X,,Thousands,,,,,,Budapest
Hungary,“Slave law” protests,Dec-18,Free,"Legislation that would increase the amount of overtime employers could demand from employees, and the creation of a parallel court system.",Democratic backslide under Prime Minister Viktor Orbán and structural economic challenges (such as support for the country’s aging population).,"100,000","Trade unions, civil society groups, opposition parties.",10 months,No policy/leadership change in response to the protests.,,X,,,Thousands,,,,,X,Budapest
Hungary,University independence protests,Sep-20,Partly free,The privatization of the University of Theater and Film Arts and the reorganization of its board under the control of an Orban ally.,"Frustration over increasing government control over higher education, restrictions on free expression, and declining academic freedom.",">5,000","General public, especially students.",2 months,No policy or leadership change in response to the protests.,,,X,,Thousands,,,,,,Budapest
India,Economic policy protests,Mar-22,Partly free,Call for protest and strike by major Indian labor unions after the government proposed a series of labor reforms.,"Frustration with the government's economic policies, which they allege have harmed workers, especially in the country's informal economic sector; opposition to a proposed labor law.",">10,000",Members of labor unions.,1 week,No policy or leadership change in response to the protests.,,X,X,,Thousands,,,,,,New Delhi
India,Hijab protest,Jan-22,Partly free,The imposition of a ban on wearing headscarves in educational institutions in Karnataka state and the circulation of a video that showed a Muslim woman being harassed by a mob of Hindu men.,Religious tensions between Hindus and Muslims and the perception that the ruling Bharatiya Janata Party is promoting Hindu nationalism to the detriment of Muslims' religious rights.,">1,000",Muslim women.,2 months,No policy/leadership change in response to protest.,,,X,,Thousands,,,,,,New Delhi
India,Farm bill protests,Sep-20,Partly free,Passage of bills on agricultural market reform and contract farming.,"Disruption of the rural farm economy, which has traditionally relied on middlemen to facilitate agricultural transactions.",">1,000,000",Farmers.,15 months,"In November 2021, Prime Minister Narendra Modi announced that his government would move to repeal the agricultural reform laws. Organizers called off protests after the government agreed to consider guaranteed prices for agricultural products.",,X,,,Tens of millions,X,X,,X,,New Delhi
India,Migrant worker protest,Apr-20,Partly free,Migrant workers’ demand to receive back wages and to be permitted to return home to local villages.,Extension of existing lockdown restrictions to combat coronavirus.,">1,000",Migrant workers.,1 day,No policy/leadership change in response to the protest.,,,X,,Thousands,,,X,,,New Delhi
India,24-hour strike,Jan-20,Partly free,Publication of government statistics predicting slowing economic growth.,Opposition to Modi’s economic policies (including privatization).,">10,000","Trade unions, students.",1 day,No policy/leadership change in response to the protests.,,,X,,Tens of thousands,,,,,,New Delhi
India,Citizenship law protests,Dec-19,Partly free,"Passage of a bill, the Citizen Amendment Act, amending India’s citizenship law. It offers conditional amnesty and a path to citizenship for non-Muslim religious minorities from three neighboring countries (Afghanistan, Bangladesh, and Pakistan) who did not migrate to the country legally. The bill contains no such exemptions for Muslim migrants, fueling criticism that it discriminates against Muslims.","Concern over rising Hindu nationalism under Prime Minister Narendra Modi, marginalization of Muslims, and opposition to migration (among citizens in northeastern India­).",">100,000","Students, young people (protesting discrimination against Muslims), citizens in northeastern India (protesting migration).",5 months,No policy/leadership change in response to the protests.,,,X,,Tens of thousands,,,,,,New Delhi
India,SC/ST Act protests,Apr-18,Partly free,"Recent Supreme Court decision stating that the Scheduled Caste and Scheduled Tribe Act (SC/ST Act), which had served to protect lower castes and Dalits from discrimination and violence, had been “rampantly misused.”","History of caste-based discrimination and violence against Dalits despite constitutional and legal protections, and impunity for those who commit crimes against Dalits.",">10,000","Members of the lower castes, Dalits.",1 week,"After the protests began, the government asked the Supreme Court to review the case. In October 2019, the Supreme Court reversed its previous ruling.",,,X,X,Thousands,X,,,,,New Delhi
India,Reservations protests,Aug-17,Partly free,"Demands by the Maratha community, which has been historically reliant on farming, for reserved quotas for government jobs and college admissions.","Rural economic downturn, rising unemployment, and view of reservations as critical for broadening economic opportunity by attaining higher education or securing better jobs.","800,000","Members of the Maratha community, young people, senior citizens.",1 year (sporadic),"In November 2018, Maharashtra’s state legislature passed a bill giving Marathas a 16 percent share of reserved slots for university admissions and government jobs under their status as a socially and economically backward class. After the reservation decision was challenged in the courts, the Bombay High Court ruled in June 2019 that the reservation quota should be lowered to 12 percent for university admissions and 13 percent for government jobs.",,,X,,Tens of thousands,X,,,,,New Delhi
India,Farmer protests,Apr-17,Partly free,"Challenges facing Indian farmers in different regions, including low crop prices, droughts, and mounting debt owed to banks or money lenders.","Discontent with government policies on farming, lack of government assistance, and stagnating incomes for farmers.","100,000",Farmers’ organizations.,"1 year, 8 months (sporadic)","There were a series of farmer protests in different states; in Maharashtra, the government promised to settle tribal farmers’ disputes over land ownership and to expand the loan-waiver scheme.",,X,X,X,Tens of thousands,,,,,,New Delhi
Indonesia,Jobs bill protests,Oct-20,Partly free,"Enactment of an omnibus Jobs Creation Bill, which reformed labor and market regulations.","Concern that reforms would weaken protections for workers, especially through reducing wages, insurance access, and pensions.",">1,000",General public.,1 month,No policy or leadership change in response to the protests.,,X,X,,Thousands,,,,,,Jakarta
Indonesia,Criminal code protests,Sep-19,Partly free,"Consideration of a new criminal code that could violate the rights of women, religious minorities, and LGBT groups, and passage of a bill to weaken the country’s anticorruption commission.",Weakening of anticorruption body and growing skepticism of President Joko Widodo’s commitment to reforms.,">10,000",University students.,1 week,The vote on a new criminal code was delayed.,,X,X,X,Tens of thousands,X,,,X,,Jakarta
Indonesia,West Papua protests,Aug-19,Partly free,Racist remarks made by military officers and nationalist militia directed against Papuan citizens.,"Discrimination against and marginalization of Papuan citizens, tensions between Papuans and the central government, desires for Papuan independence, and the effects of extractive industries in West Papua.",">10,000",Papuan citizens.,1 month,No policy/leadership change in response to the protests.,,,X,X,Tens of thousands,,,,,,Jakarta
Iran,Water shortage protests,Jul-21,Not free,"Severe water shortages amid Iran’s worst drought in decades. The July protests were focused on water shortages in Khuzestan Province, while the protests beginning in November started in Isfahan.","Frustration with government mismanagement of water resources, poor provision of services, and repression of public dissent.",">10,000",General public.,3 weeks in July 2021; November 2021 to February 2022.,No policy/leadership change in response to protest.,,X,X,,Tens of thousands,,,X,,,Tehran
Iran,Water protests,Jun-18,Not free,Undrinkable water in the cities of Khorramshahr and Abadan.,"Anger over the degradation of infrastructure, and political repression amid the public outcry over basic service delivery failures.",">1,000",General public.,2 months,No policy/leadership change in response to protests.,,,X,,Tens of thousands,X,,,,,Tehran
Iran,Downed plane protests,Jan-20,Not free,NYT,Lack of government transparency and accountability and popular discontent with political leadership.,">1,000",University students.,3 days,No policy/leadership change in response to the protests.,,X,,,Tens of thousands,X,,,,,Tehran
Iran,Fuel hike protests,Nov-19,Not free,Increase in gasoline prices due to the growing budget deficit.,Economic challenges (growing budget deficit and high inflation) and discontent toward political leaders.,"200,000",Low-income and working-class families.,1 month,No policy/leadership change in response to the protests.,,,X,,Tens of thousands,,,,,,Tehran
Iran,Budget protests,Dec-17,Not free,"Concerns over a weak economy and the high prices of basic goods, as well as the publication of a government budget that would slash cash subsidies and increase fuel prices.","Slow economic growth, lack of political freedoms and openness, and corruption.",">10,000","Younger, working-class citizens, some of whom are from towns and rural cities.",2 months,No policy/leadership change in response to the protests.,,,X,X,Tens of thousands,,,,,,Tehran
Israel,Israel coronavirus protests,Mar-20,Free,"Prime Minister Benjamin Netanyahu’s expansion of authority during the coronavirus outbreak, such as using phone surveillance technology, shutting down the court system, adjourning parliament, and planning to annex parts of the West Bank.","Perceptions of Netanyahu’s actions as antidemocratic, corrupt, or authoritarian.",">10,000",General public.,14 months,No policy/leadership change in response to the protests.,,,X,X,Tens of thousands,,X,,,X,Jerusalem
Israel,Recommendations bill protests,Dec-17,Free,"Draft law that would end the existing practice of having police recommend to prosecutors whether to indict suspects, while also preventing police recommendations from being made public and penalizing leaks from investigations. Suspicions that the law's implications could affect an ongoing investigation into Prime Minister Benjamin Netanyahu.",Government corruption and lack of transparency.,"20,000",General public.,3 weeks,Netanyahu called for reforms to the draft bill to exclude him from its purview.,,,X,,Tens of thousands,X,,,,,Jerusalem
