Brazil,Coronavirus response protests,Jan-21,Free,"First round of protests, in January, was triggered by oxygen shortages at hospitals in the city of Manaus and a sluggish rollout of Brazil’s vaccination campaign. Second round of protests, starting in May, was triggered by the government’s slow and inept response amid a third wave of infections and allegations of corruption in vaccine procurement.","Anger over inadequate resourcing of hospitals, underinvestment in vaccines, pervasive corruption, an ineffectual government response, and misinformation and denialism being spread by President Jair Bolsonaro.",">10,000",General public.,11 months,The Brazilian Senate launched an inquiry into the government’s handling of the pandemic.,,,X,X,Tens of thousands,,,,,X,Brasilia
Brazil,Coronavirus protests,Mar-20,Free,"President Jair Bolsonaro’s poor and slow response to the coronavirus outbreak; and the death of George Floyd in the United States, sparking protests against local police brutality and racism.","Lack of an effective government response to the spread of the coronavirus, racism in Brazil, and police brutality against Black Brazilians.",">1,000",General public.,4 months,No policy/leadership change in response to the protests.,,,X,,Thousands,,,X,,,Brasilia
Brazil,Education cuts protests,May-19,Free,Cuts in education spending and postgraduate scholarships.,Economic challenges and government attacks on public education.,">100,000","Students, teachers, teachers’ unions.",3 months,No policy/leadership change in response to the protests.,,,X,,Thousands,X,,X,,,Brasilia
Bulgaria,Corruption protests,Jul-20,Free,Revelations that state National Security Service agents were reserving access of a public beach for a businessman’s private use; police raids on the office of President Rumen Radev; and fresh allegations of corruption against Prime Minister Boyko Borisov.,Widespread corruption that has weakened state institutions and Bulgaria’s rule of law.,">10,000",General public.,6 months,Four ministers resigned; investigation against the President is blocked; Head of the National Security Service resigned; and the government introduces proposed constitutional reforms.,,,X,X,Tens of thousands,X,X,,X,,Sofia
Bulgaria,Coronavirus lockdown protest,May-20,Free,Enactment of lockdown measures to combat the spread of the coronavirus.,"Skepticism of the coronavirus and vaccines, and other concerns rooted in conspiracy theories and misinformation.",">1,000","Far-left activists, especially supporters of the Vazrazhdane group.",1 day,No policy or leadership change in response to the protest.,,X,,X,Tens of thousands,,,,X,,Sofia
Burkina Faso,Jihadist violence protests,Jul-21,Partly free,"Rising jihadist terror attacks on civilian targets, including a June attack that killed over 130 people. November protests were triggered by a November 14 attack on a gendarmerie camp in the northern part of the country.","Frustration with rising violence and perceived government inaction in the face of an expanding insurgency, displacement, and a humanitarian crisis.",">1,000",General public.,3 months,"President Roch Kaboré dismissed the defense minister and security minister in June 2021; in December 2021, Kaboré replaced the country’s prime minister. In January 2022, Kaboré was overthrown in a military coup.",,,X,,Thousands,X,,X,X,,Ouagadougou
Cameroon,Women's empowerment protest,Mar-22,Not free,Call for protest by women's groups; commemoration of International Women's Day.,Frustration with pervasive barriers to women's political participation and representation in senior political positions.,">10,000",Women.,1 day,No policy/leadership change in response to protest.,,,X,,Tens of thousands,,,,,,Yaounde
Cameroon,Ambazonia protests,Oct-17,Not free,The breakdown of negotiations between representatives of the English-speaking minority and the French-speaking governing majority.,Lack of political autonomy for residents of the English-speaking Northwest and Southwest regions of Cameroon.,">1,000","English-speakers, especially advocates of independence for English-speaking Ambazonia.","1 year, intermittently",No policy/leadership change in response to protests.,,X,X,,Thousands,,,,,X,Yaounde
Cameroon,Electoral protests,Oct-18,Not free,The arrest of opposition leader Maurice Kamto.,Anger over a lack of meaningful political pluralism and a crackdown against political opponents of longtime President Paul Biya.,">1,000","General public, especially supporters of Maurice Kamto.","13 months, intermittently",No policy/leadership change in response to protests.,,X,,,Tens of thousands,X,,X,,,Yaounde
Chad,Military rule protests,Apr-21,Not free,The military’s seizure of power in the wake of the death of longtime president Idriss Déby.,Frustration with the military’s role in politics and the proposed long time frame to return the country to civilian rule.,">1,000",General public.,"7 months , intermittently",No policy/leadership change in response to protests.,,,X,,Thousands,,,X,,,N'Djamena
Chad,Re-election protests,Feb-21,Not free,President Idriss Deby's nomination by the ruling Patriotic Salvation Movement for a sixth term as president.,Frustration over lack of genuine political pluralism and the entrenchment of President Deby's regime.,">1,000",General public.,1 week,No policy/leadership change in response to the protests.,,,X,,Thousands,,,,,,N'Djamena
Chad,Human rights judgment protests,Nov-19,Not free,Recurring delays in the receipt of compensation packages for human rights abuses ordered by the African Union.,Frustration over the lack of reckoning with human rights abuses perpetrated by the former regime of president Hissène Habré.,>500,Relatives of those injured or killed by the Habré government.,1 week,No policy/leadership change in response to protests.,,,X,,Thousands,,,X,,,N'Djamena
Chile,Student stipend protest,Mar-22,Free,Rising costs of living; call for protest by the Confech student federation.,Belief that the government should raise student food and living benefits amid significant economic pressure.,">1,000",Students.,1 day,No policy/leadership change in response to protest.,,X,X,,Thousands,,,,,,Santiago
Chile,Subway fare protests,Oct-19,Free,Increased price of metro fares.,"Severe inequality, low wages and pensions, poor service delivery, discontent with government, militarized response to the protests, and demand for constitutional reform.",">1,000,000","Students, young people, professionals, civil society groups.",14 months,"The subway fare hike was reversed, and legislators agreed to a 2020 referendum over whether to write a new constitution. The referendum passed overwhelmingly in October 2020. Lawmakers recently approved a bill that permits citizens to withdraw 10 percent of their pensions to help mitigate the economic impact of the pandemic.",,X,X,X,Over 1 million,X,X,X,X,,Santiago
Colombia,Tax proposal protests,Apr-21,Partly free,The government’s introduction of a proposal to raise tax rates and eliminate exemptions; a call for protests and strikes by the country’s main labor unions.,"Frustration with ongoing economic insecurity, a declining security situation, and pervasive inequality.",">10,000","Indigenous groups, labor unions, teachers, and university students.",5 months,"President Ivan Duque withdrew the tax proposal, and Finance Minister Alberto Carrasquilla resigned. A pared down version of the reform was passed in September 2021.",,X,X,,Tens of thousands,X,,X,,X,Bogota
Colombia,Coronavirus protests,Mar-20,Partly free,"President Ivan Duque’s undermining of local and regional authorities, citizens’ claims that they were not receiving sufficient social support, and rising number of deaths from the virus.","Lack of an effective government response to the spread of the coronavirus, insufficient social support for marginalized and economically disadvantaged populations, and lack of protection for healthcare workers.",">1,000",General public.,8 months,No policy/leadership change in response to the protests.,,X,X,,Thousands,,,,X,X,Bogota
Colombia,Police brutality protests,Sep-20,Partly free,Circulation of a video of police killing law student Javier Ordóñez by shooting him repeatedly with a stun gun.,Failure of the government to effectively address police brutality and violence.,">1,000",General public.,2 months,No policy or leadership change in response to the protests.,,,X,,Thousands,,,X,,,Bogota
Colombia,Prison protest,Mar-20,Partly free,"Unsanitary conditions in prisons, which could accelerate the spread of the coronavirus among inmates.","Unsanitary conditions in prisons, including overcrowding and lack of access to water.",Unknown,Prisoners.,1 day,"Colombia’s Ministry of Justice ordered the mass release of most nonviolent prisoners, so that they could temporarily serve their time at home.",,,X,,Thousands,X,,,,,Bogota
Colombia,National strikes,Nov-19,Partly free,"Rumored pensions cuts, implementation challenges of the country’s peace deal, and rising violence.","Disapproval of President Iván Duque Márquez’s government, rising economic inequality, corruption, and militarized response to protests.",">1,000,000","Students, unions, leftist groups, and indigenous groups.",4 months,No policy/leadership change in response to the protests.,,,X,,Tens of thousands,,,,,,Bogota
Comoros,Electoral protests,Mar-19,Partly free,Allegations of ballot stuffing and the improper transport of ballot boxes during the 2019 presidential election.,Concerns about the lack of electoral integrity and the entrenchment of President Azali Assoumani.,">1,000","General public, especially supporters of the political opposition.",1 week,No policy/leadership change in response to protests.,,X,X,,Hundreds of thousands,,X,,,,Moroni
Comoros,Constitutional reform protests,Jun-18,Partly free,Introduction of proposed constitutional reforms that would render President Azali Assoumani eligible for another five-year term and reduce the relative power of the archipelago’s islands by eliminating the rotating vice presidency.,Concern over the entrenchment of President Azali Assoumani and lack of political pluralism.,>500,General public.,4 months,No policy/leadership change in response to protests.,,X,X,,Hundreds of thousands,X,X,X,X,,Moroni
Comoros,Mayotte protests,Apr-18,Partly free,The expulsion of Comorian migrants in the French territory of Mayotte and the announcement of negotiations between the French and Comorian governments.,Nationalism rooted in a widespread belief in Comoros that the French-controlled island of Mayotte is an integral part of Comoros.,">1,000",General public.,1 month,No policy/leadership change in response to protests.,,X,,,Hundreds of thousands,,X,,,,Moroni
Costa Rica,Tax reform protests,Sep-18,Free,Proposed tax reforms and salary cuts for government workers.,Impact of austerity measures on lower- and middle-class workers and growing inequality.,">1,000","Trade unions, public sector workers.",1 month,No policy/leadership change in response to the protests.,,X,,,Hundreds of thousands,X,X,,,,San Jose
Croatia,Coronavirus restriction protest,Sep-20,Free,"Imposition of coronavirus restrictions, including mask and vaccine mandates.",Skepticism of the coronavirus and a belief that public health restrictions jeopardized human rights.,">1,000","General public, especially antivaccine advocates.",5 months,No policy/leadership change in response to the protest.,,,X,,Tens of thousands,,,X,X,,Zagreb
Croatia,Teachers’ strike,Nov-19,Free,Government rejection of teachers’ unions’ salary demands.,Low compensation of education workers.,"20,000","Members of teachers’ unions, teachers, children.",1 month,Government reached a wage agreement with teachers.,,X,X,,Tens of thousands,,,X,X,,Zagreb
Cuba,Economic crisis protests,Jul-21,Not free,Food and medicine shortages amid a severe economic crisis.,"Frustration with economic mismanagement, falling standards of living, poor public services, and political repression under the one-party rule.",">5,000",General public.,1 week,No policy/leadership change in response to protest.,,X,X,,Thousands,,,X,,X,Havana
Cuba,Artistic freedom protests,Nov-20,Not free,"Arrest of rapper Denis Solis, who was later sentenced to eight months in prison for insulting a police officer.",Ongoing restrictions on artistic freedom and free expression.,>100,Members of the San Isidro Movement.,1 month,No policy or leadership change in response to the protests.,,,X,,Hundreds,,,,,,Havana
Cyprus,Corruption protests,Feb-21,Free,Imposition of coronavirus lockdowns and revelations about corruption in a passport-for-investment scheme.,Frustrations with coronavirus restrictions and their social and economic impact; concerns over the spread of corruption during the pandemic.,>500,General public.,2 months,No policy/leadership change in response to protests.,,,X,X,Hundreds,,,,,X,Nicosia
Czech Republic,Coronavirus restriction protests,Jan-21,Free,Ongoing pandemic-related restrictions.,Frustration over the economic and social impacts of pandemic-related restrictions.,">3,000",General public.,14 months,No policy/leadership change in response to the protests.,,,X,,Thousands,,,,X,X,Prague
Czech Republic,“Million Moments for Democracy” protests,Apr-19,Free,"Corruption allegations against Prime Minister Andrej Babiš, and his appointment of a close ally as justice minister.","Government corruption, threats to judicial independence, and democratic backslide.","250,000",General public.,8 months,No policy/leadership change in response to the protests.,,,X,,Tens of thousands,X,,,,,Prague
Democratic Republic of the Congo,Electoral commission protest,Oct-21,Not free,A proposal by six religious groups to install Denis Kadima as head of the Independent National Electoral Commission (CENI).,Concern that the CENI may come under political influence from the government.,">10,000","General public, especially opposition groups.",1 day,No policy/leadership change in response to protest.,,,X,,Tens of thousands,,,,,,Kinshasa
Democratic Republic of the Congo,Judiciary reform protests,Jun-20,Not free,"National Assembly’s proposed changes to the juidiciary that would include proposals to define the powers of judges, and its decision to appoint Ronsard Malonda as chairman of the Independent National Electoral Commission, despite his perceived past role in rigging elections in favor of former president Joseph Kabila.","Growing tensions within the ruling coalition, concern over the political influence of Kabila, and fears that the 2023 presidential election could be subject to manipulation with a new head of the national electoral commission.",">1,000","Supporters of President Felix Tshisekedi and his party, the Union for Democracy and Social Progress (UDPS).",1 month,No policy/leadership change in response to the protests.,,,X,,Tens of thousands,,,,,,Kinshasa
Democratic Republic of the Congo,Election delay protests,Dec-17,Not free,Continued attempts by then president Joseph Kabila to stay in power beyond his term limit by delaying elections.,"Lack of transition of power, rising authoritarianism, and violent government response to protests.",">1,000","Religious leaders, civil society organizations.",6 months,"Kabila agreed to step down as president and hold new elections, which were suspected of being rigged. Despite leaving office, Kabila is seen as retaining significant influence in the new government led by President Félix Tshisekedi.",,,X,,Tens of thousands,X,,,,,Kinshasa
Dominican Republic,Corruption protests,Jul-17,Partly free,Indictment of leading political officials and businessmen in a bribery scandal.,Bribery of politicians.,">10,000",Young people.,"1 year, 6 months",No policy/leadership change in response to the protests.,,,X,,Hundreds of thousands,,X,,,,Santo Domingo
Ecuador,Fuel price protest,Oct-21,Partly free,The government's announcement that it would be reducing subsidies on fuel.,"Frustration over economic inequality, rising cost of living, and persistent inequality for the country's Indigenous groups.",">1,000","General public, especially Indigenous groups.",1 month,No policy/leadership change in response to protest.,,X,,,Thousands,,,,,,Quito
Ecuador,Coronavirus protest,May-20,Partly free,Announcement of the closure of some state-owned companies and cuts to salaries of public sector workers.,Economic impacts of the coronavirus pandemic response.,"4,000","Trade unions, social welfare organizations.",1 day,No policy/leadership change in response to the protest.,,,X,,Tens of thousands,,,X,,,Quito
Ecuador,Fuel subsidy protests,Oct-19,Partly free,Proposal of an austerity package that would increase fuel costs and cut salaries for public sector jobs.,Economic inequality and indigenous land rights.,">10,000","Indigenous groups, transportation unions, student groups, labor unions.",2 weeks,Government agreed to cancel austerity package.,,X,,,Tens of thousands,,,,,,Quito
Egypt,Friday of Anger protests,Sep-20,Not free,Call for protest by exiled opposition leader Mohamed Ali; the demolition of unlicensed homes; and increases in commodity pricing.,"Opposition to the entrenchment of the al-Sisi regime, high costs of living, and the lack of political pluralism.",">1,000","Rural citizens, especially those displaced by the government's demolition campaign.",2 weeks,No policy or leadership change in response to the protests.,,X,X,X,Thousands,,,X,,,Cairo
Egypt,Corruption protests,Sep-19,Not free,Revelations that President Abdel Fattah el-Sisi and his inner circle used public funds for personal gain.,Corruption and rising levels of poverty despite economic growth.,">1,000",Young people.,1 week,No policy/leadership change in response to the protests.,,X,,X,Tens of thousands,X,,X,X,,Cairo
El Salvador,Bitcoin protests,Sep-21,Partly free,The government's enactment of a provision to accept bitcoin as legal tender.,Concerns over rising inflation; economic mismagement; and perceived authoritarianism under President Nayib Bukele.,">4,000",General public.,2 months,No policy/leadership change in response to protest.,,X,X,,Thousands,,,,,,San Salvador
Eswatini,Pro-democracy protests,Jun-21,Not free,"Death of law student Thabani Nkomonye in May, the government’s rejection of petitions, and allegations of corruption against King Mswati III.","Frustration with the lack of political pluralism under Eswatini’s absolute monarchy, intolerance of dissent, and persistent poverty.",">5,000",General public.,4 months,No policy/leadership change in response to protest.,,X,X,,Thousands,,,X,X,,Mbabane
eSwatini,Cost of living protests,Sep-19,Not free,Low pay for teachers and other public servants.,Frustration over a lack of political pluralism; allegations of corruption against the king and his family; and rising costs of living amid a stagnating economy.,">1,000","General public, especially those employed in the public sector.",1 week,No policy/leadership change in response to protests.,,,X,,Tens of thousands,,,X,,,Mbabane
eSwatini,Pro-democracy protests,May-19,Not free,Calls for protests by pro-democracy opposition groups.,Concern over the consolidation of power under King Mswati III and the lack of genuine political representation.,">1,000",General public; opposition groups.,1 week,No policy/leadership change in response to protests.,,X,,X,Tens of thousands,X,,X,X,,Mbabane
eSwatini,Service delivery protest,Jun-18,Not free,The suspension of parliament and the introduction of a bill that would impose a fine on those who married foreigners.,"Anger over corruption, misuse of state funds, and a nationalist crackdown.",">1,000",General public.,1 day,No policy/leadership change in response to protests.,,,X,,Over 1 million,X,X,X,X,,Mbabane
Ethiopia,Oromia protests,Oct-19,Not free,Allegations circulated by opposition leader Jawar Mohammed that Prime Minister Abiy Ahmed had sent security forces to detain him.,Tensions between Ethiopia’s ethnic groups and a perception among the political opposition that the Abiy government was consolidating power and undermining the rule of law.,">1,000","General public, especially supporters of Jawar Mohammed.",1 month,No policy/leadership change in response to protests.,,,X,,Thousands,,,,,X,Addis Ababa
Ethiopia,Ethnic violence protests,Sep-18,Not free,Murder of twenty-three ethnic minorities in Ethiopia’s majority-Oromo Oromia region.,"Frustration over persistent ethnic violence, especially acts committed by Oromo youth, and anger at the government for fostering a sense of impunity by inviting the formerly banned Oromo Liberation Front to return from exile.",">1,000",Members of non-Oromo ethnic groups.,1 month,Prime Minister Abiy Ahmed denounced the violence and arrested thousands of people alleged to be involved with the violence.,,X,X,,Hundreds of thousands,X,X,,X,,Addis Ababa
Ethiopia,Hundessa protests,Jun-20,Not free,Murder of activist and singer Hachalu Hundessa.,"Ongoing wish for more autonomy for sub-national government, disputes over the construction of the Grand Ethiopian Renaissance Dam, ethnic conflicts",">5,000",Members of the Oromo ethnic group,4 months,"Amid surging ethnic violence, PM Abiy Ahmed replaced ten ministers, including the Minister of Defense, on August 18.",,,X,,Tens of thousands,,,,,,Addis Ababa
Ethiopia,Political prisoner protests,Feb-18,Not free,"Citizens’ demands for the release of senior opposition leader Bekele Gerba from prison, after then prime minister Hailemariam Desalegn had reneged on his promise to release all political prisoners. Prior protests had begun in 2015, led by the Oromo and Amhara ethnic groups over ethnic discrimination.","Demands for increased political freedom, reforms, and ethnic representation in federal structures.",">1,000",Oromo and Amhara ethnic groups.,3 days,"Opposition figures were freed, Desalegn stepped down, and the government declared a state of emergency.",,,X,,Hundreds of thousands,,X,,X,,Addis Ababa
France,May Day protest,May-22,Free,Commemoration of May Day; call for protest by labor organizations.,"Economic discontent amid rising costs of living; opposition to President Emmanuel Macron's economic agenda, including a plan to raise the retirement age.",">120,000",General public.,1 day,No policy/leadership change in response to protests.,,X,X,,Hundreds of of thousands,,X,,,,Paris
France,Health pass protest,Jul-21,Free,Introduction of a proposal that would require a “health pass” to access many amenities.,Concerns with perceived government overreach and frustration with vaccine mandates.,">150,000",General public.,8 months,No policy/leadership change in response to protest. The bill was adopted by the French National Assembly.,,,X,,Hundreds of of thousands,,X,,X,X,Paris
France,Climate law protest,May-21,Free,The National Assembly’s consideration of a climate law.,Belief that government action has been insufficient on climate change.,">1,000",General public.,1 day,No policy/leadership change in response to protest.,,,X,,Thousands,,,,,,Paris
France,Police protest,May-21,Free,A rise in attacks against police.,"Frustration with rising violence, poor working conditions for law enforcement, and a perceived failure to address underlying social ills; and the desire for increased protections for police.",">1,000",Police officers.,1 day,No policy/leadership change in response to protest.,,,X,,Thousands,,,,,,Paris
France,Anti-Semitic murder protest,Apr-21,Free,The Court of Cassation’s ruling that the killer of a Jewish woman could not be tried due to his “delirious state.”,"Frustration with the court’s determination amid rising anti-Semitic violence, and a sense of a lack of accountability for her death.",">1,000","General public, including high-level politicians.",1 day,No policy/leadership change in response to protest.,,,X,,Thousands,,,,,,Paris
France,Police security bill protests,Nov-20,Free,Approval in the Chamber of Deputies of a bill that limits the publication of images of on-duty police officers and the circulation of a video of police beating music producer Michel Zecler.,Concerns that the bill would limit accountability for police and suppress media freedom.,">100,000",General public.,4 months,The government agreed to rewrite the bill in response to protest demands.,,,X,,Huundreds of thousands,,X,,X,,Paris
France,Black Lives Matter protests,Jun-20,Free,"Deaths of George Floyd in 2020 in the United States and Adama Traore in 2016 in France, both at the hands of the police.","Police brutality in France, France’s colonial legacy, and a lack of government recognition or societal discussion of issues of systemic racism.","20,000",General public.,2 months,No policy/leadership change in response to the protests.,,X,,,Hundreds of thousands,X,X,,X,,Paris
France,Pension reform protests,Dec-19,Free,Government plans for pension reform.,Pension reform.,"800,000","Unions, public sector employees, Yellow Vest protesters, students, lawyers, rail workers.",4 months,"The government scrapped plans to raise the retirement age but maintained its plans to install other pension reforms, such as reducing the pension categories and redistributing benefits toward citizens with lower incomes.",,X,X,,Tens of thousands,,,X,,,Paris
France,“Yellow Vest” protests,Nov-18,Free,Proposal of a new fuel tax.,"Economically regressive policies, declining standard of living, growing inequality, and perception of government as overly favorable to the rich.","300,000","Initially mostly rural citizens, then later some urban working- and middle-class participants; some support from and participation by controversial far-right political groups.","1 year, 6 months","The government canceled the fuel tax increase, increased minimum wage and public spending, promised tax cuts, and initiated the Grand Débat to try to rebuild public trust in the government.",,X,,,Tens of thousands,,,,,,Paris
