North Macedonia,Opposition leader imprisonment protest,Apr-21,Partly free,Call by the opposition VMRO-DPMNE party for protests in response to over a dozen former party officials being sentenced to prison time for their role in a mob invasion of parliament in 2017.,A belief that the legal proceedings had been politically motivated; demands for a retrial.,">1,000","General public, including family members of imprisoned leaders.",1 day,No policy/leadership change in response to protest.,,,X,,Thousands,,,,,,Skopje
Oman,Economic protests,May-21,Not free,"A spate of mass layoffs, rising unemployment, and the imposition of new taxes.","Increasing economic insecurity, especially for young people, amid declining oil revenues.",>100,"General public, especially youth.",1 week,Sultan Haitham opened hiring for thousands of government jobs and unveiled a plan to drive growth in private sector employment.,,X,,,Hundreds,X,,,,,Muscat
Oman,Unemployment protest,Jan-18,Not free,Failure of government job programs to adequately reduce unemployment among citizens.,Frustration over chronically high levels of unemployment among Omani youth and feelings of economic insecurity amid declining oil revenues.,>500,"General public, especially youth.","1 year, intermittently",The government announced a job creation program and the establishment of a national center to address unemployment.,,X,X,,Tens of thousands,X,,,,,Muscat
Pakistan,Tehreek-e-Labbaik protests,Oct-21,Partly free,"A call by the leadership of Tehreek-e-Labbaik Pakistan (TLP), an outlawed far-right group, for a ""long march"" from Lahore to Islamabad.",Frustration over the imprisonment of TLP leader Saad Rizvi and the ongoing presence of the French ambassador.,">5,000",Members of TLP.,10 days,"The government and the TLP reached a negotiated settlement, which has yet to be made public.",,,X,,Thousands,X,,X,,,Islamabad
Pakistan,Youth killing protests,Mar-21,Partly free,Discovery of the bodies of four young men in a ditch outside the city of Bannu and accusations that the security services had tortured and murdered them.,Impunity for violence by the security forces.,">1,000",General public.,1 week,No policy/leadership change in response to protests.,,,X,,Thosuands,,,,,,Islamabad
Pakistan,Blasphemy protests,Nov-18,Partly free,The acquittal of a Christian woman in a highly publicized blasphemy case.,"Religious tensions between Christians and Muslims, and a belief that the government was inadequately enforcing blasphemy laws.",">5,000","General public, especially conservative Muslims.",1 month,No policy/leadership change in response to protests.,,,X,,Thousands,X,,X,,,Islamabad
Pakistan,Oath protests,Nov-17,Partly free,A proposal to change Pakistan’s electoral oath that would alter a reference to the Prophet Muhammad.,Anger over the perceived secularization of the Pakistani government.,">5,000","General public, especially conservative Muslims.",1 month,"The proposed changes were quickly revoked, a key Islamic leader was released from prison, and the law minister was forced out.",,,X,,Thousands,,,,,,Islamabad
Pakistan,Pashtun protection movement protests,Feb-2018,Partly free,The extrajudicial killing of ethnic Pashtun Naqeebullah Mehsud by police.,"Anger over persistent human rights violations by security forces in minority areas, especially Pashtun regions.",">50,000",Ethnic Pashtuns.,1 year,No policy/leadership change in response to protests.,,,X,,Hundreds,X,,X,,,Islamabad
Pakistan,Opposition protests,Oct-20,Partly freee,Call by a coalition of opposition parties for protests against the government of Prime Minister Imran Khan.,"Corruption, influence of the military in domestic politics, and suspicion that the 2018 general election had been manipulated.",">10,000","General public, especially adherents of opposition political parties.",1 week,No policy or leadership change in response to the protests.,,,X,X,Tens of thousands,,,,,,Islamabad
Pakistan,Islamabad sit-in protests,Oct-19,Partly free,Antigovernment march from Karachi to Islamabad to hold a sit-in on the capital’s main highway.,"Economic crisis, rising inflation, and suspicion that the 2018 election was rigged.","20,000",General public.,2 weeks,No policy/leadership change in response to the protests.,,,X,,Tens of thousands,X,,,,,Islamabad
Paraguay,Coronavirus response protests,Mar-21,Partly free,"A surge in coronavirus infections, strains on the health system, and a slow vaccine rollout.",Frustration with corruption in the public health system and an ineffectual response to the coronavirus pandemic.,">1,000","General public, including medical professionals.",2 weeks,Three ministers resigned in response to the protests.,,,X,X,Thousands,X,,,,X,Asunción
Peru,Rising price protests,Apr-22,Free,Rapidly rising prices for key goods including fuel and food staples.,Economic discontent as inflation makes many goods unaffordable; anger at the Pedro Castillo administration and Congress for failing to adequately address rising prices and poverty.,">5,000",General public.,1 week,No policy/leadership change in response to protests.,,X,X,,Thousands,,,X,,,Lima
Peru,Electoral protests,Jun-21,Partly free,Announcement of very close electoral results between presidential candidates Keiko Fujimori and Pedro Castillo in the June 6 presidential election.,"Concerns about electoral manipulation, and high levels of political polarization.",">5,000",Supporters of Castillo and Fujimori.,6 weeks,No policy/leadership change in response to protest.,,,X,,Thousands,,,,,,Lima
Peru,Farm protests,Dec-20,Partly free,An Agrarian Promotion Law that gave exporting companies tax benefits but led to cuts in labor rights and low wages for farm workers.,Anger over the rights of big companies being prioritized over the rights of workers who were receiving salaries as low as 39 soles ($11) per day.,>300,Farm workers.,3 weeks,"Congress repealed the law, but protests resumed when Congress could not reach a consensus on the law’s replacement, specifically on a clause for higher base salaries for workers.",,X,,,Hundreds,,,X,,,Lima
Peru,Impeachment protests,Nov-20,Partly free,A surprise vote by Peru’s opposition-led Congress to impeach and remove incumbent president Martin Vizcarra on the grounds of “moral incapacity.”,Anger that Congress would remove the popular president on dubious grounds in the midst of a national crisis.,">10,000",General public.,1 month,"Interim president Manuel Merino, a key supporter of the impeachment, resigned after only five days in office. He was succeeded by Francisco Sagasti.",,,X,X,Tens of thousands,X,,,,,Lima
Peru,Fujimori pardon protests,Dec-17,Partly free,"Then president Pedro Pablo Kuczynski’s pardon of former president Alberto Fujimori, who was convicted for corruption and human rights violations.","Controversy over Fujimori’s authoritarian legacy, and concerns that Kuczynski had pardoned him as part of a deal to survive an impeachment effort over Kuczynski’s connections to the Brazilian construction company Odebrecht.","60,000",General public.,3 days,No policy/leadership change in response to the protests.,,,X,,Tens of thousands,X,,,,,Lima
Poland,EU Protest,Oct-21,Free,A ruling by Poland's Constitutional Tribunal that contested the supremacy of EU law.,Concern that the ruling Law and Justice Party government would push for Poland to leave the European Union; frustration with the rising tensions between the Polish government and the EU.,">100,000",General public.,1 day,No policy/leadership change in response to protest.,,,X,,Hundreds of of thousands,,X,,,,Warsaw
Poland,Media law protests,Aug-21,Free,PiS party-led efforts to enact a law restricting foreign ownership of media outlets in Poland.,Frustration with declining media freedom under the PiS government.,">5,000",General public.,1 day in August 2021; 1 week in December 2021,"The governing coalition collapsed as a result of disagreements over tax policy and the media bill; in December 2021, President Andrzej Duda vetoed the media ownership bill.",,,X,,Thousands,X,,,,,Warsaw
Poland,Abortion rights protests,Oct-20,Free,"A ruling by Poland’s Constitutional Court that deemed abortion illegal in all cases except those involving rape, incest, or a threat to the mother’s life.",Anger at perceived restrictions on women’s rights and concern over political capture of the judiciary.,">5,000","General public, especially women.",4 months,No policy or leadership change in response to the protests.,,,X,,Thousands,,,,X,,Warsaw
Poland,“Muzzle law” protests,Dec-19,Free,Draft law that would permit government sanctions against judges who question the legitimacy of the ruling party’s judicial reforms and that would prohibit judges from engaging in any political activity.,Erosion of judicial independence.,"30,000",General public.,1 month,No policy/leadership change in response to the protests.,,,X,,Thousands,,,,,,Warsaw
Poland,Judicial reform protests,Jul-18,Free,Signing of a law that forced many Supreme Court justices into early retirement and created a judicial disciplinary chamber.,Erosion of judicial independence and democratic backslide.,">10,000","Polish judges and lawyers, judges from across Europe.",3 weeks,No policy/leadership change in response to the protests.,,,X,X,Thousands,,,,,,Warsaw
Portugal,Police brutality protest,Jun-20,Free,"Death of George Floyd in the United States, sparking protests against local police brutality and racism in Portugal.","Police brutality, systemic racism, and lack of government recognition of systemic racism.",">10,000","Key participants varied by protest, from urban young people to Romanian diaspora, magistrates.",1 day,No policy/leadership change in response to the protests.,,X,,,Tens of thousands,X,,X,X,,Lisbon
Romania,Covid restriction protest,Oct-21,Free,"The imposition of coronavirus restrictions, including mandatory masking and vaccine orders.",Frustration over vaccine and testing requirements.,">5,000","General public, including right-wing groups.",1 day,No policy/leadership change in response to protest.,,,X,,Thousands,,,,,,Bucharest
Romania,Corruption protests,Jan-17,Free,"Government attempts to decriminalize corruption offenses, limit judicial independence through reforms, and obstruct anticorruption investigations.","Government corruption, subversion of democratic processes, and erosion of judicial independence.","500,000",General public.,2 years (sporadic),"In some (but not all) cases, the government reversed decrees in response to the protests.",,,,,Tens of thousands,,,X,,,Bucharest
Russia,Aleksei Navalny arrest protests,Jan-21,Not free,Arrest of opposition leader and anticorruption activist Aleksei Navalny.,"Frustration over a lack of genuine political pluralism, widespread corruption, and economic stagnation.",">100,000",General public.,4 months,No policy/leadership change in response to protests.,,X,X,X,Hundreds of of thousands,,X,,X,,Moscow
Russia,Khabarovsk protests,Jul-20,Not free,Arrest of the popular regional governor Sergei Furgal on murder charges.,"Increasing resentment among the outer regions of Russia toward the Kremlin for intruding in regional affairs, anger among opposition parties that feel they are powerless in the restrictive political system, and concern over political repression.","50,000",General public.,5 months,No policy/leadership change in response to the protests.,,,X,X,Tens of thousands,,,,X,,Moscow
Russia,Coronavirus restrictions protest,Apr-20,Not free,Economic implications of the shutdown and self-isolation measures established in response to the coronavirus pandemic.,"Concern over the economic effects of the shutdown, particularly in poorer areas that have lower infection rates.","2,000","Opposition leaders, activists.",1 day,No policy/leadership change in response to the protest.,,X,X,,Thousands,X,,X,X,,Moscow
Russia,Constitutional changes protests,Feb-20,Not free,"Constitutional changes that could allow President Vladimir Putin to stay in power past 2024, as well as the five-year anniversary of the death of an opposition leader.","Opposition to constitutional changes, falling popularity of Putin","22,000",General public.,1 month,No policy/leadership change in response to the protests.,,,X,,Thousands,,,X,X,,Moscow
Russia,Moscow election protests,Jul-19,Not free,Banning of some opposition politicians from running in Moscow city council elections.,Growing authoritarianism under President Vladimir Putin.,"50,000",Political opposition.,1 month,No policy/leadership change in response to the protests.,,,X,,Thousands,,,X,X,,Moscow
Russia,Corruption protest,Mar-17,Not free,"Publication of a video by opposition politician Alexei Navalny, alleging that then prime minister Dmitry Medvedev had accumulated luxury mansions, yachts, and vineyards.",Economic downturn and corruption.,"60,000","Opposition groups with various political affiliations, young people.",1 day,No policy/leadership change in response to the protests.,,,X,,Thousands,,,,X,,Moscow
Senegal,Opposition leader arrest protests,Mar-21,Partly free,Arrest of opposition leader Ousmane Sonko.,Frustration with decreasing political pluralism and the perception that incumbent President Macky Sall is suppressing political opposition.,">1,000",General public.,1 month,No policy/leadership change in response to protests.,,,X,,Thousands,,,,,,Dakar
Serbia,Environmental protest,Sep-21,Partly free,Call for protest by thirty environmental groups over plans to develop a lithium mine; introduction of laws to ease expropriation of land and the holding of referenda on environmental issues.,Concerns over worsening pollution and the environmental impact of mining.,">1,000",General public.,4 months,"The Serbian government announced that it would hold a referendum on future mine and factory construction; in December 2021, the government suspended laws and plans that would have allowed the project to go forward; and in January it announced that the project had been canceled altogether.",,X,X,,Thousands,X,,,X,,Belgrade
Serbia,Coronavirus protests,Jul-20,Partly free,Announcement that the government would reimpose a curfew and other restrictions amid a surge in COVID-19 cases—just two weeks after the country’s parliamentary elections that opposition leaders decried as illegitimate.,"Public perceptions that President Aleksandar Vucic’s decision to lift lockdown measures in May was only made to give his party the advantage in the upcoming parliamentary elections (by acting as if he had defeated the outbreak), concerns over the true extent of the outbreak, and exasperation with underlying issues of government corruption and authoritarianism.",">10,000",Opposition parties.,4 weeks,No policy/leadership change in response to the protests.,,,X,,Hundreds,,,X,,,Belgrade
Serbia,“1 Out of 5 Million” protests,Dec-18,Free,"Violent attack on an opposition leader, and President Aleksandar Vučić’s mockery of the ensuing protests.","Corruption, nepotism, government incompetence, state control of media, and rising authoritarianism.","37,500",Young people.,"1 year, 2 months",No policy/leadership change in response to the protests.,,,X,,Thousands,,,X,,,Belgrade
Slovakia,Coronavirus restrictions protest,Nov-20,Free,Ongoing pandemic-related restrictions and the commemoration of Slovenia’s national Fight for Freedom and Democracy Day.,Frustration with ongoing coronavirus restrictions.,">1,000","General public, especially far-right activists.",1 day,No policy or leadership change in response to the protests.,,,X,,Thousands,,,,,X,Bratislava
Slovakia,“For a Decent Slovakia” protests,Mar-18,Free,Murder of a journalist who was at the time investigating connections between the Italian mafia and high-ranking Slovakian politicians.,Continued government corruption and popular distrust in the current government.,"65,000",General public.,"1 year, 6 months",Then prime minister Robert Fico resigned and was succeeded by a deputy.,,,X,,Thousands,,,,,,Bratislava
Slovenia,Anti-Jansa protests,Mar-20,Free,"Allegations of corruption, illiberalism, and declining freedom under the government of Prime Minister Janez Jansa.",Frustration with rising illiberalism and poor governance under Jansa’s government.,">10,000",General public.,"16 months, intermittently",No policy/leadership change in response to protest.,,,X,X,Tens of thousands,,,,X,X,Ljubljana
Solomon Islands,Malaita protests,Nov-21,Free,Call for protests by Malaita for democracy amid growing tensions between the government of Malaita Province and the national government over relations with China and the United States.,Frustration over unequal distribution of resources between Guadalcanal and Malaita and the government's decision in 2019 to recognize the People's Republic of China instead of Taiwan.,">1,000",Residents of Malaita.,2 weeks,No policy/leadership change in response to protest.,,X,X,,Thousands,,,,,,Honiara
Somalia,Examination protest,May-19,Not free,"The leakage of information on the unified national secondary school exam on social media, and an announcement that the exams would be rescheduled.",Anger over poor service delivery and the failure to administer the exam.,">1,000","General public, especially students.",1 week,No policy/leadership change in response to protests.,,,X,,Thousands,,,,,,Mogadishu
Somalia,Soldier pay protests,Mar-17,Not free,Government failure to give fifteen months of back pay owed to soldiers.,Anger over corruption and poor working conditions for soldiers.,">2,000",Soldiers.,3 months,Officials promised that soldiers would get back pay.,,,X,,Hundreds,,,X,,,Mogadishu
Somalia,Police violence protests,Apr-20,Not free,The fatal shooting of two civilians by security forces enforcing coronavirus lockdown restrictions.,"Recurring police brutality, especially during the enforcement of coronavirus restrictions.",>500,General public.,1 week,The perpetrator was arrested and charged with murder.,,X,X,X,Thousands,,,,,,Mogadishu
South Africa,Zuma arrest protests,Jul-21,Free,Imprisonment of former president Jacob Zuma after he was found guilty of contempt of court.,"Fragmentation within the African National Congress, strong loyalty to Zuma, concerns that the judicial process had been politicized, and frustrations with long-standing poverty and inequality.",">10,000",General public.,2 weeks,No policy/leadership change in response to protest.,,,X,X,Tens of thousands,,,X,,,"Pretoria, Cape Town, Bloemfontein"
South Africa,Violence against women protests,Sep-19,Free,Spate of femicides.,Violence against women and lack of institutional protections for women.,"4,000","Trade unions, students, feminist groups, families, representatives from parties on the political right and left.",1 month,"In November 2019, President Cyril Ramphosa launched a “16 days of activism” campaign to raise awareness around the rights of women and girls. In his 2020 State of the Union, Ramphosa announced plans to help curb violence against women.",,,X,,Thousands,,,X,,,"Pretoria, Cape Town, Bloemfontein"
South Africa,Anti-Zuma protest,Apr-17,Free,Ouster of popular African National Congress finance minister Pravin Gordhan.,"Economic challenges, inequality, corruption, political cronyism, and growing disapproval of then president Jacob Zuma.","30,000",Gender rights activist organizations.,1 day,No policy/leadership change in response to the protests.,,X,X,X,Thousands,,,,,,"Pretoria, Cape Town, Bloemfontein"
South Korea,Justice minister protests,Oct-19,Free,"Allegations of corruption against the then justice minister, Cho Kuk, who had pushed for prosecutorial reforms.",Government corruption and public distrust of prosecutors.,">100,000","General public, but particularly right-wing activists.",2 months,Then justice minister Cho resigned.,,X,,,Thousands,X,,,,,Seoul
South Korea,Candlelight demonstrations,Oct-16,Free,"Revelations that Choi Soon-sil, the confidante and old friend of then president Park Geun-hye, exercised undue influence. Choi allegedly urged businesses to donate to her own foundations in return for political favors, accessed classified government documents despite lacking the necessary authorization, and played a role in selecting presidential aides.","Improper influence of outside individuals, including friends of politicians as well as business elites and family-run conglomerates; increasing class divisions and inequality and lack of social mobility and economic opportunity, especially for younger citizens; and patriarchy and sexism in South Korea.",1.5 million,"Anti-Cho protesters: evangelical Christian activists, conservatives, older citizens; pro-Cho protestors: younger, urban, white-collar workers.",5 months,Park was impeached.,,,X,,Thousands,X,,,,,Seoul
Spain,Rising price protests,Mar-22,Free,"Rising prices for food, fuel, and energy.",Frustration with rising economic pressures and the perceived failure of the government to address rising prices.,">100,000","Farmers, truckers.",1 week,No policy/leadership change in response to protest.,,X,X,,Hundreds of of thousands,,X,,,,Madrid
Spain,Rapper arrest protests,Feb-21,Free,"The arrest of rapper Pablo Hasel, a supporter of Catalonian independence who was convicted of terrorism-related offenses in the wake of the Catalan independence movement.",Ongoing tensions between advocates of Catalonian independence and the Spanish government and concerns over suppression of free expression.,">1,000","General public, especially supporters of Catalonian independence.",3 weeks,No policy/leadership change in response to protests.,,,X,,Thousands,,,X,,,Madrid
Spain,Coronavirus lockdown protest,Aug-20,Free,"Introduction of social restrictions, including smoking bans and the closure of nightclubs, in repsonse to the COVID-19 pandemic.",Opposition to stringent social restrictions and increasingly widespread belief in COVID-related conspiracy theories.,">2,500",Supporters of the far-right Vox party.,1 day,No policy/leadership change in response to the protests.,,,X,,Thousands,,,X,,,Madrid
Spain,Coronavirus protest,May-20,Free,"Protesters’ claims that the government misrepresented the extent of the health crisis, violated citizens’ rights by confining them to their homes and ruling by decree, and damaged the economy.","Economic effects of the lockdown, and concerns of government overreach.",Thousands,Pro-independence groups and their supporters.,1 day,No policy/leadership change in response to the protest.,,X,X,,Thousands,,,,,,Madrid
Spain,Catalan independence protests,Oct-19,Free,Sentencing of Catalan separatist leaders to prison.,"Catalan independence, dissatisfaction with the government response to the independence movement, and belief that Catalonia should retain more of its own tax revenues.","600,000",Supporters of the former prime minister.,2 months,"No policy/leadership change in response to the protests. After winning support from Catalan separatist party, Prime Minister Pedro Sánchez promised to resolve the Catalan dispute through dialogue.",,X,X,,Thousands,,,X,,,Madrid
Sri Lanka,Constitutional crisis protests,Oct-18,Partly free,Then president Maithripala Sirisena’s dismissal of then prime minster Ranil Wickremesinghe and the suspension of parliament.,Fears of majoritarianism and return of minority repression.,"62,500","General public, trade union of professionals, women.",2 days,Wickremasinghe was reappointed as prime minister for a time.,,X,X,,Thousands,,,X,,,Colombo
Sudan,National Congress Party protests,Oct-19,Not free,Lack of punitive action against members of former president Omar Bashir’s inner circle.,Frustration over the ongoing influence of members of Bashir’s National Congress Party and impunity for perpetrators of protest crackdowns.,">1,000",General public.,2 months,The government dissolved the National Congress Party.,,,X,,Thousands,,,,,,Khartoum
Sudan,Darfur insecurity protests,Jul-20,Not free,Recurring militia attacks in the Darfur region.,Anger over the state’s failure to keep citizens safe from militia attacks.,">1,000",Residents of Darfur.,1 month,The government dismissed the regional chief of police and his deputy.,,X,,X,Thousands,X,,,,,Khartoum
Sudan,Sudanese revolution,Dec-18,Not free,Hike in bread prices during a period of high inflation.,"Discontent with the ruling party and political and economic elites, economic downturn, and the heavy-handed response to initial protests.",">100,000","Public employees such as military personnel, teachers, police, civil servants.",1 year,"Then president Omar Al-Bashir was forced out of office, and his regime was dismantled. A transition government composed of both military and civilian leaders is currently in place, with elections scheduled for 2021.",,X,X,,Hundreds,X,,,,,Khartoum
Switzerland,Coronavirus restriction protests,Feb-21,Free,The imposition of vaccine mandates and public health restrictions across Switzerland.,Frustration with ongoing coronavirus restrictions and mandates; demands for a national referendum on COVID-19 policy.,">10,000",General public.,1 year,"Switzerland held a referendum on legislation enabling coronavirus restrictions, including a health pass in November 2021, which passed.",,,X,,Tens of thousands,X,,,X,X,Bern
Syria,Economic crisis protests,Jun-20,Not free,Imposition of U.S. sanctions that decreased the value of the Syrian pound by two-thirds.,Economic insecurity stemming from the rapid devaluation of the Syrian pound.,>500,General public.,1 month,Prime minister Imad Khamis was fired from his post.,,,,X,Thousands,,,,,,Damascus
Taiwan,Taiwan “Yellow Vest” protests,Dec-18,Free,High taxes and the unfair handling of tax disputes.,An unfair and confusing taxation system.,"20,000","Coalition of opposition parties, protestors from varying age groups, social classes, ethnicities.",2 weeks,No policy/leadership change in response to the protests.,,,X,,Hundreds,X,,,,,Taipei
